ffff8c07cafb5d40 1033302232 S Ci:1:001:0 s a3 00 0000 0001 0004 4 <
ffff8c07cafb5d40 1033302283 C Ci:1:001:0 0 4 = 00010000
ffff8c07cafb5d40 1033302290 S Ci:1:001:0 s a3 00 0000 0002 0004 4 <
ffff8c07cafb5d40 1033302305 C Ci:1:001:0 0 4 = 00010000
ffff8c07cafb5d40 1033302310 S Ci:1:001:0 s a3 00 0000 0003 0004 4 <
ffff8c07cafb5d40 1033302325 C Ci:1:001:0 0 4 = 00010000
ffff8c07cafb5d40 1033302329 S Ci:1:001:0 s a3 00 0000 0004 0004 4 <
ffff8c07cafb5d40 1033302345 C Ci:1:001:0 0 4 = 00010000
ffff8c07cafb5d40 1033302349 S Ci:1:001:0 s a3 00 0000 0005 0004 4 <
ffff8c07cafb5d40 1033302364 C Ci:1:001:0 0 4 = 00010000
ffff8c07cafb5d40 1033302369 S Ci:1:001:0 s a3 00 0000 0006 0004 4 <
ffff8c07cafb5d40 1033302386 C Ci:1:001:0 0 4 = 07050000
ffff8c07cafb5d40 1033302390 S Ci:1:001:0 s a3 00 0000 0007 0004 4 <
ffff8c07cafb5d40 1033302406 C Ci:1:001:0 0 4 = 00010000
ffff8c07cafb5d40 1033302410 S Ci:1:001:0 s a3 00 0000 0008 0004 4 <
ffff8c07cafb5d40 1033302425 C Ci:1:001:0 0 4 = 00010000
ffff8c07cafb5d40 1033302429 S Ci:1:001:0 s a3 00 0000 0009 0004 4 <
ffff8c07cafb5d40 1033302445 C Ci:1:001:0 0 4 = 00010000
ffff8c07cafb5d40 1033302449 S Ci:1:001:0 s a3 00 0000 000a 0004 4 <
ffff8c07cafb5d40 1033302465 C Ci:1:001:0 0 4 = 00010000
ffff8c07cafb5d40 1033302469 S Ci:1:001:0 s a3 00 0000 000b 0004 4 <
ffff8c07cafb5d40 1033302484 C Ci:1:001:0 0 4 = 00010000
ffff8c07cafb5d40 1033302489 S Ci:1:001:0 s a3 00 0000 000c 0004 4 <
ffff8c07cafb5d40 1033302503 C Ci:1:001:0 0 4 = 00010000
ffff8c07cafb5d40 1033302508 S Ci:1:001:0 s a3 00 0000 000d 0004 4 <
ffff8c07cafb5d40 1033302524 C Ci:1:001:0 0 4 = 00010000
ffff8c07cafb5d40 1033302528 S Ci:1:001:0 s a3 00 0000 000e 0004 4 <
ffff8c07cafb5d40 1033302545 C Ci:1:001:0 0 4 = 00010000
ffff8c07cafb5d40 1033302549 S Ci:1:001:0 s a3 00 0000 000f 0004 4 <
ffff8c07cafb5d40 1033302565 C Ci:1:001:0 0 4 = 00010000
ffff8c07cafb5d40 1033302569 S Ci:1:001:0 s a3 00 0000 0010 0004 4 <
ffff8c07cafb5d40 1033302585 C Ci:1:001:0 0 4 = 00010000
ffff8c0711a80780 1033302590 S Ii:1:001:1 -115:2048 4 <
ffff8c07cafb5d40 1033302603 S Ci:1:001:0 s a3 00 0000 0006 0004 4 <
ffff8c07cafb5d40 1033302619 C Ci:1:001:0 0 4 = 07050000
ffff8c07cafb5d40 1033302623 S Co:1:001:0 s 23 01 0002 0006 0000 0
ffff8c07cafb5d40 1033349553 C Co:1:001:0 0 0
ffff8c0711a80780 1033349609 C Ii:1:001:1 0:2048 3 = 400000
ffff8c0711a80780 1033349619 S Ii:1:001:1 -115:2048 4 <
ffff8c07cafb5d40 1033401570 S Ci:1:001:0 s a3 00 0000 0006 0004 4 <
ffff8c07cafb5d40 1033401604 C Ci:1:001:0 0 4 = 03050400
ffff8c07cafb5d40 1033401616 S Co:1:001:0 s 23 01 0012 0006 0000 0
ffff8c07cafb5d40 1033401631 C Co:1:001:0 0 0
ffff8c07cafb5d40 1033421504 S Ci:1:045:0 s 80 00 0000 0000 0002 2 <
ffff8c07cafb5d40 1033422196 C Ci:1:045:0 0 2 = 0100
ffff8c07cafb5d40 1033422240 S Ci:1:045:0 s a3 00 0000 0001 0004 4 <
ffff8c070b0e8b40 1033422252 S Ci:1:001:0 s a3 00 0000 0006 0004 4 <
ffff8c070b0e8b40 1033422284 C Ci:1:001:0 0 4 = 03050000
ffff8c07cafb5d40 1033422293 C Ci:1:045:0 0 4 = 00010000
ffff8c07cafb5d40 1033422315 S Ci:1:045:0 s a3 00 0000 0002 0004 4 <
ffff8c07cafb5d40 1033422353 C Ci:1:045:0 0 4 = 00010000
ffff8c07cafb5d40 1033422367 S Ci:1:045:0 s a3 00 0000 0003 0004 4 <
ffff8c07cafb5d40 1033422403 C Ci:1:045:0 0 4 = 00010000
ffff8c07cafb5d40 1033422416 S Ci:1:045:0 s a3 00 0000 0004 0004 4 <
ffff8c07cafb5d40 1033422452 C Ci:1:045:0 0 4 = 00010000
ffff8c072f50dd40 1033422465 S Ii:1:045:1 -115:2048 1 <
ffff8c072f50dd40 1033422563 C Ii:1:045:1 -2:2048 0
ffff8c07cafb5d40 1033422580 S Co:1:045:0 s 00 03 0001 0000 0000 0
ffff8c07cafb5d40 1033422979 C Co:1:045:0 0 0
ffff8c07cafb5d40 1033423001 S Co:1:001:0 s 23 03 0002 0006 0000 0
ffff8c07cafb5d40 1033441678 C Co:1:001:0 0 0
ffff8c0711a80780 1033465554 C Ii:1:001:1 -2:2048 0
ffff8c07cafb5d40 1033485630 S Ci:1:001:0 s a3 00 0000 0001 0004 4 <
ffff8c07cafb5d40 1033485667 C Ci:1:001:0 0 4 = 00010000
ffff8c07cafb5d40 1033485678 S Ci:1:001:0 s a3 00 0000 0002 0004 4 <
ffff8c07cafb5d40 1033485695 C Ci:1:001:0 0 4 = 00010000
ffff8c07cafb5d40 1033485700 S Ci:1:001:0 s a3 00 0000 0003 0004 4 <
ffff8c07cafb5d40 1033485715 C Ci:1:001:0 0 4 = 00010000
ffff8c07cafb5d40 1033485720 S Ci:1:001:0 s a3 00 0000 0004 0004 4 <
ffff8c07cafb5d40 1033485735 C Ci:1:001:0 0 4 = 00010000
ffff8c07cafb5d40 1033485740 S Ci:1:001:0 s a3 00 0000 0005 0004 4 <
ffff8c07cafb5d40 1033485755 C Ci:1:001:0 0 4 = 00010000
ffff8c07cafb5d40 1033485759 S Ci:1:001:0 s a3 00 0000 0006 0004 4 <
ffff8c07cafb5d40 1033485775 C Ci:1:001:0 0 4 = 07050000
ffff8c07cafb5d40 1033485779 S Ci:1:001:0 s a3 00 0000 0007 0004 4 <
ffff8c07cafb5d40 1033485795 C Ci:1:001:0 0 4 = 00010000
ffff8c07cafb5d40 1033485800 S Ci:1:001:0 s a3 00 0000 0008 0004 4 <
ffff8c07cafb5d40 1033485815 C Ci:1:001:0 0 4 = 00010000
ffff8c07cafb5d40 1033485819 S Ci:1:001:0 s a3 00 0000 0009 0004 4 <
ffff8c07cafb5d40 1033485835 C Ci:1:001:0 0 4 = 00010000
ffff8c07cafb5d40 1033485839 S Ci:1:001:0 s a3 00 0000 000a 0004 4 <
ffff8c07cafb5d40 1033485855 C Ci:1:001:0 0 4 = 00010000
ffff8c07cafb5d40 1033485859 S Ci:1:001:0 s a3 00 0000 000b 0004 4 <
ffff8c07cafb5d40 1033485875 C Ci:1:001:0 0 4 = 00010000
ffff8c07cafb5d40 1033485879 S Ci:1:001:0 s a3 00 0000 000c 0004 4 <
ffff8c07cafb5d40 1033485894 C Ci:1:001:0 0 4 = 00010000
ffff8c07cafb5d40 1033485898 S Ci:1:001:0 s a3 00 0000 000d 0004 4 <
ffff8c07cafb5d40 1033485914 C Ci:1:001:0 0 4 = 00010000
ffff8c07cafb5d40 1033485919 S Ci:1:001:0 s a3 00 0000 000e 0004 4 <
ffff8c07cafb5d40 1033485934 C Ci:1:001:0 0 4 = 00010000
ffff8c07cafb5d40 1033485938 S Ci:1:001:0 s a3 00 0000 000f 0004 4 <
ffff8c07cafb5d40 1033485953 C Ci:1:001:0 0 4 = 00010000
ffff8c07cafb5d40 1033485958 S Ci:1:001:0 s a3 00 0000 0010 0004 4 <
ffff8c07cafb5d40 1033485975 C Ci:1:001:0 0 4 = 00010000
ffff8c0711a80780 1033485979 S Ii:1:001:1 -115:2048 4 <
ffff8c0711a80780 1033486033 C Ii:1:001:1 -2:2048 0
ffff8c0669388000 1034902267 S Ci:1:001:0 s a3 00 0000 0001 0004 4 <
ffff8c0669388000 1034902308 C Ci:1:001:0 0 4 = 00010000
ffff8c0669388000 1034902314 S Ci:1:001:0 s a3 00 0000 0002 0004 4 <
ffff8c0669388000 1034902329 C Ci:1:001:0 0 4 = 00010000
ffff8c0669388000 1034902334 S Ci:1:001:0 s a3 00 0000 0003 0004 4 <
ffff8c0669388000 1034902348 C Ci:1:001:0 0 4 = 00010000
ffff8c0669388000 1034902353 S Ci:1:001:0 s a3 00 0000 0004 0004 4 <
ffff8c0669388000 1034902368 C Ci:1:001:0 0 4 = 00010000
ffff8c0669388000 1034902373 S Ci:1:001:0 s a3 00 0000 0005 0004 4 <
ffff8c0669388000 1034902391 C Ci:1:001:0 0 4 = 00010000
ffff8c0669388000 1034902397 S Ci:1:001:0 s a3 00 0000 0006 0004 4 <
ffff8c0669388000 1034902415 C Ci:1:001:0 0 4 = 07050000
ffff8c0669388000 1034902421 S Ci:1:001:0 s a3 00 0000 0007 0004 4 <
ffff8c0669388000 1034902438 C Ci:1:001:0 0 4 = 00010000
ffff8c0669388000 1034902444 S Ci:1:001:0 s a3 00 0000 0008 0004 4 <
ffff8c0669388000 1034902461 C Ci:1:001:0 0 4 = 00010000
ffff8c0669388000 1034902467 S Ci:1:001:0 s a3 00 0000 0009 0004 4 <
ffff8c0669388000 1034902484 C Ci:1:001:0 0 4 = 00010000
ffff8c0669388000 1034902491 S Ci:1:001:0 s a3 00 0000 000a 0004 4 <
ffff8c0669388000 1034902509 C Ci:1:001:0 0 4 = 00010000
ffff8c0669388000 1034902516 S Ci:1:001:0 s a3 00 0000 000b 0004 4 <
ffff8c0669388000 1034902531 C Ci:1:001:0 0 4 = 00010000
ffff8c0669388000 1034902536 S Ci:1:001:0 s a3 00 0000 000c 0004 4 <
ffff8c0669388000 1034902552 C Ci:1:001:0 0 4 = 00010000
ffff8c0669388000 1034902558 S Ci:1:001:0 s a3 00 0000 000d 0004 4 <
ffff8c0669388000 1034902576 C Ci:1:001:0 0 4 = 00010000
ffff8c0669388000 1034902582 S Ci:1:001:0 s a3 00 0000 000e 0004 4 <
ffff8c0669388000 1034902599 C Ci:1:001:0 0 4 = 00010000
ffff8c0669388000 1034902605 S Ci:1:001:0 s a3 00 0000 000f 0004 4 <
ffff8c0669388000 1034902622 C Ci:1:001:0 0 4 = 00010000
ffff8c0669388000 1034902629 S Ci:1:001:0 s a3 00 0000 0010 0004 4 <
ffff8c0669388000 1034902647 C Ci:1:001:0 0 4 = 00010000
ffff8c0711a80780 1034902654 S Ii:1:001:1 -115:2048 4 <
ffff8c0669388000 1034902675 S Ci:1:001:0 s a3 00 0000 0006 0004 4 <
ffff8c0669388000 1034902694 C Ci:1:001:0 0 4 = 07050000
ffff8c0669388000 1034902701 S Co:1:001:0 s 23 01 0002 0006 0000 0
ffff8c0669388000 1034949548 C Co:1:001:0 0 0
ffff8c0711a80780 1034949607 C Ii:1:001:1 0:2048 3 = 400000
ffff8c0711a80780 1034949611 S Ii:1:001:1 -115:2048 4 <
ffff8c0669388000 1034997509 S Ci:1:001:0 s a3 00 0000 0006 0004 4 <
ffff8c0669388000 1034997540 C Ci:1:001:0 0 4 = 03050400
ffff8c0669388000 1034997552 S Co:1:001:0 s 23 01 0012 0006 0000 0
ffff8c0669388000 1034997565 C Co:1:001:0 0 0
ffff8c0669388000 1035021591 S Ci:1:045:0 s 80 00 0000 0000 0002 2 <
ffff8c0669388000 1035022159 C Ci:1:045:0 0 2 = 0100
ffff8c070b0e8fc0 1035022210 S Ci:1:001:0 s a3 00 0000 0006 0004 4 <
ffff8c070b0e8fc0 1035022231 C Ci:1:001:0 0 4 = 03050000
ffff8c070b0e8fc0 1035022250 S Ci:1:045:0 s a3 00 0000 0001 0004 4 <
ffff8c070b0e8fc0 1035022324 C Ci:1:045:0 0 4 = 00010000
ffff8c070b0e8fc0 1035022335 S Ci:1:045:0 s a3 00 0000 0002 0004 4 <
ffff8c070b0e8fc0 1035022389 C Ci:1:045:0 0 4 = 00010000
ffff8c070b0e8fc0 1035022402 S Ci:1:045:0 s a3 00 0000 0003 0004 4 <
ffff8c070b0e8fc0 1035022491 C Ci:1:045:0 0 4 = 00010000
ffff8c070b0e8fc0 1035022514 S Ci:1:045:0 s a3 00 0000 0004 0004 4 <
ffff8c070b0e8fc0 1035022576 C Ci:1:045:0 0 4 = 00010000
ffff8c072f50dd40 1035022591 S Ii:1:045:1 -115:2048 1 <
ffff8c072f50dd40 1035022685 C Ii:1:045:1 -2:2048 0
ffff8c070b0e8fc0 1035022697 S Co:1:045:0 s 00 03 0001 0000 0000 0
ffff8c070b0e8fc0 1035023146 C Co:1:045:0 0 0
ffff8c070b0e8fc0 1035023168 S Co:1:001:0 s 23 03 0002 0006 0000 0
ffff8c070b0e8fc0 1035041634 C Co:1:001:0 0 0
ffff8c0711a80780 1035061675 C Ii:1:001:1 -2:2048 0
ffff8c070b0e98c0 1035081646 S Ci:1:001:0 s a3 00 0000 0001 0004 4 <
ffff8c070b0e98c0 1035081686 C Ci:1:001:0 0 4 = 00010000
ffff8c070b0e98c0 1035081698 S Ci:1:001:0 s a3 00 0000 0002 0004 4 <
ffff8c070b0e98c0 1035081714 C Ci:1:001:0 0 4 = 00010000
ffff8c070b0e98c0 1035081719 S Ci:1:001:0 s a3 00 0000 0003 0004 4 <
ffff8c070b0e98c0 1035081734 C Ci:1:001:0 0 4 = 00010000
ffff8c070b0e98c0 1035081739 S Ci:1:001:0 s a3 00 0000 0004 0004 4 <
ffff8c070b0e98c0 1035081754 C Ci:1:001:0 0 4 = 00010000
ffff8c070b0e98c0 1035081758 S Ci:1:001:0 s a3 00 0000 0005 0004 4 <
ffff8c070b0e98c0 1035081774 C Ci:1:001:0 0 4 = 00010000
ffff8c070b0e98c0 1035081778 S Ci:1:001:0 s a3 00 0000 0006 0004 4 <
ffff8c070b0e98c0 1035081790 C Ci:1:001:0 0 4 = 07050000
ffff8c070b0e98c0 1035081795 S Ci:1:001:0 s a3 00 0000 0007 0004 4 <
ffff8c070b0e98c0 1035081810 C Ci:1:001:0 0 4 = 00010000
ffff8c070b0e98c0 1035081816 S Ci:1:001:0 s a3 00 0000 0008 0004 4 <
ffff8c070b0e98c0 1035081831 C Ci:1:001:0 0 4 = 00010000
ffff8c070b0e98c0 1035081835 S Ci:1:001:0 s a3 00 0000 0009 0004 4 <
ffff8c070b0e98c0 1035081851 C Ci:1:001:0 0 4 = 00010000
ffff8c070b0e98c0 1035081856 S Ci:1:001:0 s a3 00 0000 000a 0004 4 <
ffff8c070b0e98c0 1035081871 C Ci:1:001:0 0 4 = 00010000
ffff8c070b0e98c0 1035081875 S Ci:1:001:0 s a3 00 0000 000b 0004 4 <
ffff8c070b0e98c0 1035081890 C Ci:1:001:0 0 4 = 00010000
ffff8c070b0e98c0 1035081895 S Ci:1:001:0 s a3 00 0000 000c 0004 4 <
ffff8c070b0e98c0 1035081911 C Ci:1:001:0 0 4 = 00010000
ffff8c070b0e98c0 1035081916 S Ci:1:001:0 s a3 00 0000 000d 0004 4 <
ffff8c070b0e98c0 1035081931 C Ci:1:001:0 0 4 = 00010000
ffff8c070b0e98c0 1035081936 S Ci:1:001:0 s a3 00 0000 000e 0004 4 <
ffff8c070b0e98c0 1035081951 C Ci:1:001:0 0 4 = 00010000
ffff8c070b0e98c0 1035081955 S Ci:1:001:0 s a3 00 0000 000f 0004 4 <
ffff8c070b0e98c0 1035081971 C Ci:1:001:0 0 4 = 00010000
ffff8c070b0e98c0 1035081975 S Ci:1:001:0 s a3 00 0000 0010 0004 4 <
ffff8c070b0e98c0 1035081991 C Ci:1:001:0 0 4 = 00010000
ffff8c0711a80780 1035081995 S Ii:1:001:1 -115:2048 4 <
ffff8c0711a80780 1035082046 C Ii:1:001:1 -2:2048 0
ffff8c070b0e98c0 1036059464 S Ci:1:001:0 s a3 00 0000 0001 0004 4 <
ffff8c070b0e98c0 1036059502 C Ci:1:001:0 0 4 = 00010000
ffff8c070b0e98c0 1036059513 S Ci:1:001:0 s a3 00 0000 0002 0004 4 <
ffff8c070b0e98c0 1036059523 C Ci:1:001:0 0 4 = 00010000
ffff8c070b0e98c0 1036059528 S Ci:1:001:0 s a3 00 0000 0003 0004 4 <
ffff8c070b0e98c0 1036059543 C Ci:1:001:0 0 4 = 00010000
ffff8c070b0e98c0 1036059548 S Ci:1:001:0 s a3 00 0000 0004 0004 4 <
ffff8c070b0e98c0 1036059561 C Ci:1:001:0 0 4 = 00010000
ffff8c070b0e98c0 1036059566 S Ci:1:001:0 s a3 00 0000 0005 0004 4 <
ffff8c070b0e98c0 1036059577 C Ci:1:001:0 0 4 = 00010000
ffff8c070b0e98c0 1036059582 S Ci:1:001:0 s a3 00 0000 0006 0004 4 <
ffff8c070b0e98c0 1036059590 C Ci:1:001:0 0 4 = 07050000
ffff8c070b0e98c0 1036059596 S Ci:1:001:0 s a3 00 0000 0007 0004 4 <
ffff8c070b0e98c0 1036059606 C Ci:1:001:0 0 4 = 00010000
ffff8c070b0e98c0 1036059611 S Ci:1:001:0 s a3 00 0000 0008 0004 4 <
ffff8c070b0e98c0 1036059626 C Ci:1:001:0 0 4 = 00010000
ffff8c070b0e98c0 1036059634 S Ci:1:001:0 s a3 00 0000 0009 0004 4 <
ffff8c070b0e98c0 1036059645 C Ci:1:001:0 0 4 = 00010000
ffff8c070b0e98c0 1036059649 S Ci:1:001:0 s a3 00 0000 000a 0004 4 <
ffff8c070b0e98c0 1036059657 C Ci:1:001:0 0 4 = 00010000
ffff8c070b0e98c0 1036059662 S Ci:1:001:0 s a3 00 0000 000b 0004 4 <
ffff8c070b0e98c0 1036059672 C Ci:1:001:0 0 4 = 00010000
ffff8c070b0e98c0 1036059676 S Ci:1:001:0 s a3 00 0000 000c 0004 4 <
ffff8c070b0e98c0 1036059685 C Ci:1:001:0 0 4 = 00010000
ffff8c070b0e98c0 1036059689 S Ci:1:001:0 s a3 00 0000 000d 0004 4 <
ffff8c070b0e98c0 1036059699 C Ci:1:001:0 0 4 = 00010000
ffff8c070b0e98c0 1036059703 S Ci:1:001:0 s a3 00 0000 000e 0004 4 <
ffff8c070b0e98c0 1036059712 C Ci:1:001:0 0 4 = 00010000
ffff8c070b0e98c0 1036059716 S Ci:1:001:0 s a3 00 0000 000f 0004 4 <
ffff8c070b0e98c0 1036059729 C Ci:1:001:0 0 4 = 00010000
ffff8c070b0e98c0 1036059733 S Ci:1:001:0 s a3 00 0000 0010 0004 4 <
ffff8c070b0e98c0 1036059741 C Ci:1:001:0 0 4 = 00010000
ffff8c0711a80780 1036059745 S Ii:1:001:1 -115:2048 4 <
ffff8c0711a80780 1036105506 C Ii:1:001:1 0:2048 3 = 400000
ffff8c0711a80780 1036105515 S Ii:1:001:1 -115:2048 4 <
ffff8c070b0e98c0 1036105575 S Ci:1:001:0 s a3 00 0000 0006 0004 4 <
ffff8c070b0e98c0 1036105608 C Ci:1:001:0 0 4 = 03050400
ffff8c070b0e98c0 1036105611 S Co:1:001:0 s 23 01 0012 0006 0000 0
ffff8c070b0e98c0 1036105618 C Co:1:001:0 0 0
ffff8c070b0e98c0 1036129561 S Ci:1:001:0 s a3 00 0000 0006 0004 4 <
ffff8c070b0e98c0 1036129580 C Ci:1:001:0 0 4 = 03050000
ffff8c070b0e98c0 1036149527 S Ci:1:045:0 s 80 00 0000 0000 0002 2 <
ffff8c070b0e98c0 1036150048 C Ci:1:045:0 0 2 = 0100
ffff8c070b0e98c0 1036150062 S Ci:1:045:0 s a3 00 0000 0001 0004 4 <
ffff8c070b0e98c0 1036150093 C Ci:1:045:0 0 4 = 01030100
ffff8c070b0e98c0 1036150098 S Co:1:045:0 s 23 01 0010 0001 0000 0
ffff8c070b0e98c0 1036150133 C Co:1:045:0 0 0
ffff8c070b0e98c0 1036150137 S Ci:1:045:0 s a3 00 0000 0002 0004 4 <
ffff8c070b0e98c0 1036150223 C Ci:1:045:0 0 4 = 00010000
ffff8c070b0e98c0 1036150231 S Ci:1:045:0 s a3 00 0000 0003 0004 4 <
ffff8c070b0e98c0 1036150310 C Ci:1:045:0 0 4 = 00010000
ffff8c070b0e98c0 1036150318 S Ci:1:045:0 s a3 00 0000 0004 0004 4 <
ffff8c070b0e98c0 1036150393 C Ci:1:045:0 0 4 = 00010000
ffff8c072f50dd40 1036257589 S Ii:1:045:1 -115:2048 1 <
ffff8c070b0e98c0 1036257634 S Ci:1:045:0 s a3 00 0000 0001 0004 4 <
ffff8c070b0e98c0 1036257690 C Ci:1:045:0 0 4 = 01030000
ffff8c070b0e98c0 1036257702 S Co:1:045:0 s 23 03 0016 0001 0000 0
ffff8c070b0e98c0 1036258277 C Co:1:045:0 0 0
ffff8c070b0e98c0 1036258401 S Co:1:045:0 s 23 03 0004 0001 0000 0
ffff8c070b0e98c0 1036258446 C Co:1:045:0 0 0
ffff8c070b0e98c0 1036277557 S Ci:1:045:0 s a3 00 0000 0001 0004 4 <
ffff8c070b0e98c0 1036277626 C Ci:1:045:0 0 4 = 03031000
ffff8c070b0e98c0 1036277637 S Co:1:045:0 s 23 01 0014 0001 0000 0
ffff8c070b0e98c0 1036277663 C Co:1:045:0 0 0
ffff8c070b0e98c0 1036341617 S Ci:1:000:0 s 80 06 0100 0000 0040 64 <
ffff8c070b0e98c0 1036342256 C Ci:1:000:0 0 18 = 12010002 00000008 3c411a30 00010102 0001
ffff8c070b0e98c0 1036342311 S Co:1:045:0 s 23 03 0004 0001 0000 0
ffff8c070b0e98c0 1036342343 C Co:1:045:0 0 0
ffff8c070b0e98c0 1036361582 S Ci:1:045:0 s a3 00 0000 0001 0004 4 <
ffff8c070b0e98c0 1036361669 C Ci:1:045:0 0 4 = 03031000
ffff8c070b0e98c0 1036361680 S Co:1:045:0 s 23 01 0014 0001 0000 0
ffff8c070b0e98c0 1036361706 C Co:1:045:0 0 0
ffff8c070b0e98c0 1036441601 S Ci:1:047:0 s 80 06 0100 0000 0012 18 <
ffff8c070b0e98c0 1036442307 C Ci:1:047:0 0 18 = 12010002 00000008 3c411a30 00010102 0001
ffff8c070b0e98c0 1036442343 S Ci:1:047:0 s 80 06 0200 0000 0009 9 <
ffff8c070b0e98c0 1036442925 C Ci:1:047:0 0 9 = 09022200 010100a0 32
ffff8c070b0e98c0 1036442941 S Ci:1:047:0 s 80 06 0200 0000 0022 34 <
ffff8c070b0e98c0 1036443964 C Ci:1:047:0 0 34 = 09022200 010100a0 32090400 00010301 02000921 11010001 222e0007 05810304
ffff8c070b0e98c0 1036443990 S Ci:1:047:0 s 80 06 0300 0000 00ff 255 <
ffff8c070b0e98c0 1036444428 C Ci:1:047:0 0 4 = 04030904
ffff8c070b0e98c0 1036444453 S Ci:1:047:0 s 80 06 0302 0409 00ff 255 <
ffff8c070b0e98c0 1036445774 C Ci:1:047:0 0 58 = 3a034400 65006c00 6c002000 4d005300 31003100 36002000 55005300 42002000
ffff8c070b0e98c0 1036445803 S Ci:1:047:0 s 80 06 0301 0409 00ff 255 <
ffff8c070b0e98c0 1036446374 C Ci:1:047:0 0 14 = 0e035000 69007800 41007200 7400
ffff8c070b0e98c0 1036449533 S Co:1:047:0 s 00 09 0001 0000 0000 0
ffff8c070b0e98c0 1036449815 C Co:1:047:0 0 0
ffff8c070b0e98c0 1036449853 S Co:1:047:0 s 21 0a 0000 0000 0000 0
ffff8c070b0e98c0 1036450139 C Co:1:047:0 0 0
ffff8c070b0e98c0 1036450144 S Ci:1:047:0 s 81 06 2200 0000 002e 46 <
ffff8c070b0e98c0 1036451340 C Ci:1:047:0 0 46 = 05010902 a1010901 a1000509 19012903 15002501 95087501 81020501 09300931
ffff8c070b0e98c0 1036451425 S Ii:1:047:1 -115:8 4 <
